{
  "schema_version": 1,
  "scene_id": "scn_23j7x56k3y7a",
  "space_id": "spc_23j7x37m5w2a",
  "version": 1,
  "created_at": "2026-10-17T15:00:00Z",
  "job_id": "job_23j7x52k5m2b",
  "assets": {
    "full": "ast_23j7x62k4x7c",
    "lite": "ast_23j7x63k5y2d",
    "grid": "ast_23j7x64k6z3e"
  },
  "asset_table": {
    "ast_23j7x62k4x7c": {
      "schema_version": 1,
      "asset_id": "ast_23j7x62k4x7c",
      "kind": "splat_full",
      "format": "spz",
      "uri": "https://cdn.nammaspace.org/scenes/v001/splat_full.spz",
      "sha256": "e3b0c44298fc1c149afbf4c8996fb92427ae41e4649b934ca495991b7852b855",
      "bytes": 48201948,
      "gaussians": 1250000
    },
    "ast_23j7x63k5y2d": {
      "schema_version": 1,
      "asset_id": "ast_23j7x63k5y2d",
      "kind": "splat_lite",
      "format": "spz",
      "uri": "https://cdn.nammaspace.org/scenes/v001/splat_lite.spz",
      "sha256": "ca978112ca1bbdcafac231b39a23dc4da786eff8147c4e72b9807785afee48bb",
      "bytes": 18402910,
      "gaussians": 500000
    },
    "ast_23j7x64k6z3e": {
      "schema_version": 1,
      "asset_id": "ast_23j7x64k6z3e",
      "kind": "grid",
      "format": "json",
      "uri": "https://cdn.nammaspace.org/scenes/v001/navgrid.json",
      "sha256": "4e07408562bedb8b60ce05c1decfe3ad16b72230967de01f640b7e4729b49fce",
      "bytes": 1420
    }
  },
  "transform": {
    "world_from_splat": [
      1.0, 0.0, 0.0, 0.0,
      0.0, 1.0, 0.0, 0.0,
      0.0, 0.0, 1.0, 0.0,
      0.0, 0.0, 0.0, 1.0
    ],
    "scale": 1.024,
    "method": "floor_ransac+tape_pair",
    "residuals": {
      "floor_rms_m": 0.018,
      "scale_check_error_pct": 1.25
    }
  },
  "start_pose": {
    "x": 0.0,
    "z": 0.0,
    "yaw_deg": 45.0
  },
  "eye_height_m": 1.5,
  "bounds": {
    "minX": -3.0,
    "maxX": 3.0,
    "minZ": -4.0,
    "maxZ": 4.0
  }
}
